Stage,LoveReq,SubReq,VarReq,Interaction,Result,NextStage,LoveMod,SubMod,Function
0,0,0,SidneyAvail,Meet Sidney.,,0,0,0,SidneyStart()
0,0,0,,Wait for a while.,You wait for a little while and|check the crowd at the pub.,0,0,0,Wait()
0,0,0,,Leave the pub.,,0,0,0,Leave()
100,0,0,Common_PlayerChaste,I have the same problem.|I'll find a way out.,Fine!  But find a solution quick.|This belt is driving me insane.,101,1,0,
100,0,8,,"Calm down girl, this belt|will come off when I decide.",(She bows her head.)  Very well Miss.|But know that this is drving me insane.,101,0,1,"SetPose(""Shy"")"
100,8,0,,This is only to tease|you a little sweetie.,(She blushes.)  Tease me for what?|You know that this is driving me insane?,101,1,0,"SetPose(""Neutral"")"
100,0,0,,I have no idea|how to unlock it.,Don't mess with shit you don't understand!|You know that this is driving me insane?,101,0,-1,
100,0,0,,You'd better learn|to live with it.,Fuck you then!  I'll find a way out.|You know that this is driving me insane?,101,-1,0,
100,0,0,,I have some tools|for it at the dorm.,Great!  Maybe it could work.|This belt is driving me insane.,101,1,0,
100,0,0,,You'll find a way|to remove it.,I guess.  But it better be soon.|This belt is driving me insane.,101,0,0,
101,0,0,,It will help you|with self-control.,I don't need self-control!|(She punches the table.),102,0,1,
101,0,8,,This is part of|your training.,Training?  What the fuck?|(She punches the table.),102,0,1,
101,0,0,,It's a very short drive.|You're already insane.,You're not funny COMMON_PLAYERNAME!|(She punches the table.),102,-1,0,
101,0,0,,"Yeah, it must|be frustrating.",Fuck yeah it's frustrating!|(She punches the table.),102,0,0,
102,0,0,,Don't get mad.,You don't want to...  (She pauses.)  Oh fuck!|(She checks around and ducks behind the counter.),200,0,0,"SetPose(""Duck"")"
102,0,0,,Don't hurt me!,You're pathetic girl.  (She pauses.)  Oh fuck!|(She checks around and ducks behind the counter.),200,0,-1,"SetPose(""Duck"")"
102,0,0,,You want to fight?,Let's fight then!  (She pauses.)  Oh fuck!|(She checks around and ducks behind the counter.),200,0,1,"SetPose(""Duck"")"
102,0,0,,Nice!  That was|quite a punch.,Damn right girl!  (She pauses.)  Oh fuck!|(She checks around and ducks behind the counter.),200,1,-1,"SetPose(""Duck"")"
110,0,8,,"Calm down girl, the egg|will be out when I decide.",(She bows her head.)  Very well Miss.|But know that this is drving me insane.,111,0,1,"SetPose(""Shy"")"
110,8,0,,This is only to tease|you a little sweetie.,(She blushes.)  Tease me for what?|You know that this is driving me insane?,111,1,0,"SetPose(""Neutral"")"
110,0,0,,I have no idea|how to remove it.,Don't mess with shit you don't understand!|You know that this is driving me insane?,111,0,-1,
110,0,0,,You'd better learn|to live with it.,Fuck you then!  I'll remove it somehow.|You know that this is driving me insane?,111,-1,0,
110,0,0,,You'll find a way|to remove it.,I guess.  But it better be soon.|This egg is driving me insane.,111,0,0,
111,0,0,,I bet you're|very horny now.,Shit yeah!  I want it out!|(She punches the table.),112,0,0,
111,0,8,,This is part of|your training.,Training?  What the fuck?|(She punches the table.),112,0,1,
111,0,0,,It's a very short drive.|You're already insane.,You're not funny COMMON_PLAYERNAME!|(She punches the table.),112,-1,0,
112,0,0,,Don't get mad.,You don't want to...  (She pauses.)  Oh fuck!|(She checks around and ducks behind the counter.),200,0,0,"SetPose(""Duck"")"
112,0,0,,Don't hurt me!,You're pathetic girl.  (She pauses.)  Oh fuck!|(She checks around and ducks behind the counter.),200,0,-1,"SetPose(""Duck"")"
112,0,0,,You want to fight?,Let's fight then!  (She pauses.)  Oh fuck!|(She checks around and ducks behind the counter.),200,0,1,"SetPose(""Duck"")"
112,0,0,,Nice!  That was|quite a punch.,Damn right girl!  (She pauses.)  Oh fuck!|(She checks around and ducks behind the counter.),200,1,-1,"SetPose(""Duck"")"
120,0,0,,A beer?  Fine.|(Get her a beer.),(You buy her a beer and she smiles.)|Perfect!  You can hang with me now.,121,0,0,
120,0,0,,Of course Miss.|(Get her a beer.),(You buy her a beer and she smiles.)|Perfect!  You can hang with me now.,121,0,-1,
120,0,0,,Go get your|own beer.,You finaly grown some balls?|I guess you can hang with me.,121,0,1,
120,0,0,,Forget it!|(Leave Sidney.),You leave Sidney behind|and get back to the bar.,0,0,1,SidneyEnd()
121,0,0,,How are you Miss?,I'm not drunk.  I'm not great.,122,0,-1,
121,0,0,,Are you getting|drunk here?,"Yep, slowly but surely.",122,0,0,
121,0,0,,How's the beer?,"Pretty shitty, but it's cheap.|Perfect to get drunk.",122,1,0,
121,0,0,,So you drink alone?,Why do you care?  I can|get drunk any way I want.,122,-1,1,
122,0,0,,You should not get|wasted all the time.,Are you my mom?  (She pauses.)  Oh fuck!|(She checks around and ducks behind the counter.),200,0,1,"SetPose(""Duck"")"
122,0,0,,Binge drinking is|dangerous for you.,You're a loser.  (She pauses.)  Oh fuck!|(She checks around and ducks behind the counter.),200,-1,0,"SetPose(""Duck"")"
122,0,0,,I'll drink to that!,Cheers!  (She pauses.)  Oh fuck!|(She checks around and ducks behind the counter.),200,1,0,"SetPose(""Duck"")"
122,0,0,,That's a way to|spend an evening.,The best way.  (She pauses.)  Oh fuck!|(She checks around and ducks behind the counter.),200,0,0,"SetPose(""Duck"")"
130,0,0,,I came here|to relax.,Good idea.  School is so boring.|We need some time to enjoy life.,131,0,0,
130,0,0,,I came here to drink.|Go get me a beer.,Great idea!  (She comes back with two beers.)|This is so much better than our boring college.,131,1,1,
130,0,0,,I got lost and|ended up here.,You got lost?  That's pretty silly.|At least you're out of our boring classes.,131,0,-1,"SetPose(""Neutral"")"
130,0,0,,I came here to drink.|Get me some red wine.,Ok.  (She comes back with wine and a beer.)|This is so much better than our boring college.,131,0,1,
131,0,0,,You're boring!,(She gives you an angry look.)|You look tense.  Wanna smoke?,132,-1,0,
131,0,0,,"Yeah, it was|a long day.",Fuck yeah.  We have to forget it.|Do you want to smoke with me?,132,0,0,
131,0,0,,It's never boring|when you're around.,You're sweet Miss COMMON_PLAYERNAME.|Do you want to smoke with me?,132,1,0,
132,0,0,,You should quit|smoking girl.,I've heard that so...  (She pauses.)  Oh fuck!|(She checks around and ducks behind the counter.),200,-1,1,"SetPose(""Duck"")"
132,0,0,,Smoking makes|me nauseous.,That's pretty lame.  (She pauses.)  Oh fuck!|(She checks around and ducks behind the counter.),200,0,-1,"SetPose(""Duck"")"
132,0,0,,Maybe later.,That's fine for...  (She pauses.)  Oh fuck!|(She checks around and ducks behind the counter.),200,0,0,"SetPose(""Duck"")"
132,0,0,,Yes!  Let's go|for a smoke.,Perfect!  Let me...  (She pauses.)  Oh fuck!|(She checks around and ducks behind the counter.),200,1,0,"SetPose(""Duck"")"
140,0,0,,I'm here to kick|your fucking ass.,Oh yeah?  Let's go outside|and I will break your bones.,141,-1,1,"SetPose(""Angry"")"
140,0,0,,What's your problem?,You're my fucking problem!|Let's go out and I will crush you.,141,0,0,
140,0,0,,Are you still|angry at me?,Fuck yeah I'm still angry!|Let's go out and I will crush you.,141,0,-1,
140,0,0,,Can we talk?,(She stares at you.)|What do you want?,142,0,0,
140,0,0,,Calm down girl.,(She stares at you.)|What do you want?,142,0,1,
140,0,0,,I came to make peace|and offer you a beer.,(She takes the beer and calms down.)|Alright.  Tell me what you want.,142,1,0,"SetPose(""Neutral"")"
141,0,0,,Wait!  This is|going too far.,Too late sucker...  (She pauses.)  Oh fuck!|(She checks around and ducks behind the counter.),200,0,-1,"SetPose(""Duck"")"
141,0,0,,How about some|arm wrestling?,That could work...  (She pauses.)  Oh fuck!|(She checks around and ducks behind the counter.),200,0,0,"SetPose(""Duck"")"
141,0,0,,Let's fight|right here!,You got it girl!  (She pauses.)  Oh fuck!|(She checks around and ducks behind the counter.),200,0,1,"SetPose(""Duck"")"
142,0,0,,Maybe we could help|each other in school.,Maybe we could...  (She pauses.)  Oh fuck!|(She checks around and ducks behind the counter.),200,1,0,"SetPose(""Duck"")"
142,0,0,,I need protection.,It will cost ya...  (She pauses.)  Oh fuck!|(She checks around and ducks behind the counter.),200,0,-1,"SetPose(""Duck"")"
142,0,0,,I want your advice|on something.,Ask away sucker...  (She pauses.)  Oh fuck!|(She checks around and ducks behind the counter.),200,0,0,"SetPose(""Duck"")"
150,0,0,,Thanks my friend!|So how are you?,I'm not drunk.  I'm not great.,152,1,0,
150,0,0,,Are you getting|drunk here?,"Yep, slowly but surely.",152,0,0,
150,0,0,,How's the beer?,"Pretty shitty, but it's cheap.|Perfect to get drunk.",152,0,0,
150,0,0,,So you drink alone?,Why do you care?  I can|get drunk any way I want.,152,-1,1,
150,0,0,,You look cute|in these shorts.,"Thanks, you're also very pretty.",151,1,0,
150,0,0,,Hey sexy!|Nice legs.,Well thank you.|You look great also.,151,0,1,
150,0,0,,I will buy|the beer.,Good girl!  (She laughs.)|It's time to get drunk.,152,0,-1,
151,0,0,,(Blush.)  You really|think I'm pretty?,Sure you do.  (She pauses.)  Oh fuck!|(She checks around and ducks behind the counter.),200,0,-1,"SetPose(""Duck"")"
151,0,0,,"Yep, I'm the|cutest around.",What?  You're not...  (She pauses.)  Oh fuck!|(She checks around and ducks behind the counter.),200,-1,0,"SetPose(""Duck"")"
151,0,0,,We will have a|good evening.,"Yeah, it should be...  (She pauses.)  Oh fuck!|(She checks around and ducks behind the counter.)",200,0,0,"SetPose(""Duck"")"
152,0,0,,You should not get|wasted all the time.,Are you my mom?  (She pauses.)  Oh fuck!|(She checks around and ducks behind the counter.),200,0,1,"SetPose(""Duck"")"
152,0,0,,Binge drinking is|dangerous for you.,You're a loser.  (She pauses.)  Oh fuck!|(She checks around and ducks behind the counter.),200,-1,0,"SetPose(""Duck"")"
152,0,0,,I'll drink to that!,Cheers!  (She pauses.)  Oh fuck!|(She checks around and ducks behind the counter.),200,1,0,"SetPose(""Duck"")"
152,0,0,,That's a way to|spend an evening.,The best way.  (She pauses.)  Oh fuck!|(She checks around and ducks behind the counter.),200,0,0,"SetPose(""Duck"")"
