Tag,Content
Intro1,Chapitre 3 - La retenue du matin (Cliquez pour continuer)
Intro2,"Pour avoir causer des problèmes, Sidney et vous êtes envoyées en retenue."
Intro3,"La salle de retenue est une salle de réunion, où une professeur vous attend."
Intro4,Vous êtes invitée à vous assoir et à attendre jusqu'à ce que la retenue soit terminée.
Intro5,Sidney entre dans la salle menottée et s'assoit en face de vous.
Intro6,"Il est 8H20 et la retenue finit à 9H00, qu'allez-vous faire pour tuer le temps ?"
