Tag,Content
FindItem,You check the wooden counter and|find a box with an interesting item.
TrainRopeMasteryNoTime,You don't have enough time to|study the comic before your next class.
CannotMasturbate,You try to slide a finger inside|your belt but fail miserably.
Orgasm,"You stimulate yourself lovingly and|tremble with ecstasy, getting a silent orgasm."
OrgasmEnough,You play with yourself but|you're not horny anymore.
OrgasmRepeat,You touch yourself and the vibrating egg|kicks in to give you desires for another round.
