Tag,Content
Orgasm,aaaaaaAAAAAAHHH!!! (Yuki squeezes your face|in while she gets a shattering orgasm.)
StopPleasure,"(She pushes you back.)  No, stop!|You're not good at that, it's been too long."
LickEgg,"(She drops her panties, grabs your hair and pulls|you close.)  This is your punishment for the egg."
LickSub,"(She drops her panties, grabs your hair and|pulls you close.)  Get to work little pet."
NoPullEgg,(You try to pull back but she grabs your hair.)|You've put that egg in.  You will finish the job!
NoPullSub,(You try to pull back but she grabs your hair.)|Where do you think you're going subbie girl?
