Stage,LoveReq,SubReq,VarReq,Interaction,Result,NextStage,LoveMod,SubMod,Function
0,0,0,,What's wrong?,I can't find my fucking purse|and I'm hungry as shit!,10,0,0,
0,0,0,,Calm down!,Calm down?  Can't you see I'm|hungry and I can't find my purse!,10,-1,0,
0,0,0,,What is your|problem girl?,I'm going nuts!  I can't find|my purse and I'm hungry as hell!,10,0,1,
0,0,0,,Maybe I can|try to help.,Help me search!  I lost my|purse and I'm fucking hungry!,10,0,-1,
10,0,0,,Where did you|last saw your purse?,I don't know!  I can't think when I'm|hungry.  Can you give me some money?,20,0,0,
10,0,0,,Are there thieves|in this college?,They would be insane to steal from me.|Now can you give me some money?,20,0,0,
10,0,5,,Stop worrying girl.|I'll buy you lunch.,"Miss?  You will?  That's really great.|I'm ready when you are, do we leave now?",30,0,1,
10,5,0,,Come with me friend.|I'll buy your lunch.,"Really?  That's fucking awesome.|I'm ready to go, do we leave now?",30,1,0,
10,0,0,,You will survive|skipping a meal.,Fuck you bitch!|(She walks away.),90,-1,0,EndLunch()
10,0,0,,I saw a blond girl|running with a purse.,(She charges like a bull in the hallway.)|SAAAAAAARRRRRRRAAAAAHHH!!!,90,1,0,EndLunch()
20,0,0,,Go beg elsewhere.,Fuck you bitch!|(She walks away.),90,-1,1,EndLunch()
20,0,0,,"Sorry, I'm broke.","Shit, shit, shit!|(She walks away.)",90,0,0,EndLunch()
20,0,0,,Have some money.|(Give money to Sidney.),Thanks sucker!|(She grabs your money and runs.),90,1,-1,EndLunch()
20,0,5,,Stop worrying girl.|I'll buy you lunch.,"Miss?  You will?  That's really great.|I'm ready when you are, do we leave now?",30,0,1,
20,5,0,,Come with me friend.|I'll buy your lunch.,"Really?  That's fucking awesome.|I'm ready to go, do we leave now?",30,1,0,
30,0,0,,Let's go now!|(Eat with Sidney.),You walk pretty fast to a restaurant nearby.|Sidney quickly picks a table and seems really hungry.,200,0,0,StartLunch()
100,0,0,,What's wrong?,I can't find my fucking purse|and I'm hungry as shit!,110,0,0,
100,0,0,,What is your|problem girl?,I'm going nuts!  I can't find|my purse and I'm hungry as hell!,110,0,1,
100,0,0,,Can I help you?,No you cannot!  I lost my fucking|purse and I'm hungry as shit!,110,0,-1,
110,0,0,,Maybe I can|help you find it.,Fuck no!  I don't want to search.|I want to eat!  Gimme some money.,120,0,-1,NoLeave()
110,0,0,,You have enough|time to find it.,Shut up!  I want to eat now!|Gimme some money.,120,0,0,NoLeave()
110,0,0,,You'll have to|skip lunch then.,"Fuck you, I'm not skipping lunch!|Gimme some money!",120,-1,0,NoLeave()
110,0,0,,You can survive|on your reserves.,Say that again and I'll break all of your bones.|Now gimme some money before I kill you.,120,-2,1,NoLeave()
110,0,0,,I saw a blond girl|running with a purse.,(She charges like a bull in the hallway.)|SAAAAAAARRRRRRRAAAAAHHH!!!,90,1,0,EndLunch()
110,0,0,,Have some money then.|(Give money to Sidney.),Thanks sucker!|(She grabs your money and runs.),90,1,-1,EndLunch()
120,0,0,,"Here, this is a gift.|(Give money to Sidney.)",Thanks sucker!|(She grabs your money and runs.),90,1,-1,EndLunch()
120,0,0,,Repay me tomorrow.|(Give money to Sidney.),Fine.  (She grabs your money and runs.),90,1,0,EndLunch()
120,0,0,,I don't have|any money.,You little fucking liar!  Come with me.|(She grabs your arm and drags you in the basement.),130,-1,0,
120,0,0,,I'm not giving|you anything.,You fucking bitch!  Come with me.|(She grabs your arm and drags you in the basement.),130,-1,1,
130,0,0,,Ow!  It hurts!,And it will hurt a lot more soon.|It's your last chance.  Pay or suffer.,140,0,-1,
130,0,0,,Where are we?,A place I know and you don't want to know.|Now this is your last chance.  Pay or suffer.,140,0,0,
130,0,0,,You fucking pig!,(She stares at you with furious eyes.)|This is your last chance.  Pay or suffer.,140,-1,0,
130,0,0,,"Ok, ok, here it is.|(Give money to Sidney.)",Finally!  (She grabs your money and runs.),90,0,0,EndLunch()
140,0,0,,Here's your money.|(Give money to Sidney.),Sucker!  (She grabs your money and runs.),90,0,0,EndLunch()
140,0,0,,I'm not giving|you anything.,Then suffer!  (She grips you and|drags you in some wooden pillory.),150,-1,-1,Pillory()
150,0,0,,What the hell!|You can't do that.,"Enjoy your lunch bitch, I'll be back later.|(She grabs your purse and runs away.)",160,0,0,
150,0,0,,You will pay|for that!,"You're paying right now, I'll be back later.|(She grabs your purse and runs away.)",160,0,1,
150,0,0,,I'm sorry Sidney.|Can you release me?,It's too late bitch!  I'll be back later.|(She grabs your purse and runs away.),160,0,-1,
160,0,0,,(Wait patiently.),(You wait patiently while your stomach|grumbles but there's no sign of Sidney.),160,0,0,PilloryWait()
160,0,0,,HELP!  SOMEONE|CAN HEAR ME?,(You scream for help but nobody comes.),160,0,0,PilloryWait()
160,0,0,,(Try to break|the device.),(You try to force or break the|pillory but it doesn't move.),160,0,0,PilloryWait()
160,0,0,,(Try to slip|your hands.),(You try to slip your hands out|but the hole is too narrow.),160,0,0,PilloryWait()
170,0,0,,I will obey.|(Bow your head.),Perfect!  Now get out of my face.|(You pick up your purse and items.),180,0,-1,PilloryFree()
170,0,0,,This is extortion!,That's true little bitch.  Now fuck off.|(You pick up your purse and items.),180,0,0,PilloryFree()
170,0,0,,Someday you will|pay for that.,We'll see about that.  Now fuck off.|(You pick up your purse and items.),180,0,1,PilloryFree()
180,0,0,,(End lunch break.),,180,0,0,EndChapter()
200,0,0,,It's a nice|place you found.,My stupid roommates are here all|the time so I don't come here often.,210,0,0,
200,0,0,,This restaurant|looks alright.,My stupid roommates are here all|the time so I don't come here often.,210,0,0,
200,0,0,,What should I get?,I don't care!  (She looks around.)|Are my stupid roommates here?,210,0,0,
200,0,0,,So what are|you eating?,Fucking meat!  (She looks around.)|Are my stupid roommates here?,210,0,0,
210,0,0,,You have roommates?|You're pretty lucky.,Oh fuck no!  This is hell.|Someday I'll make them pay.,220,0,0,BadMatch()
210,0,0,,You have roommates?|That can be painful.,"Yeah, they are a pain in the ass.|Someday I'll make them pay.",220,0,0,GoodMatch()
210,0,0,,I wish I had|some roommates.,You want mine?  They are a pain.|Someday I'll make them pay.,220,0,0,
220,0,0,,You need help|to get even?,"That's a great idea!  Let's talk after school.|Tell me about you, what do you want to do in life?",230,1,0,GoodMatch()
220,0,0,,You should try|to make peace.,"Peace?  Fuck no!  Let's change subject.|Tell me about you, what do you want to do in life?",230,-1,0,BadMatch()
220,0,0,,Someday you'll|have your revenge.,"Yep!  And this day will come pretty soon.|Tell me about you, what do you want to do in life?",230,0,0,GoodMatch()
230,0,0,,A musician.,You will end up poor as shit.|And what's your favorite class?,240,0,0,BadMatch()
230,0,0,,A doctor.,Nice!  You will make good money.|And what's your favorite class?,240,0,0,GoodMatch()
230,0,0,,An athlete.,You will end up poor as shit.|And what's your favorite class?,240,0,0,BadMatch()
230,0,0,,A teacher.,"Not bad, there will always be jobs.|And what's your favorite class?",240,0,0,
230,0,0,,An actor.,You will end up poor as shit.|And what's your favorite class?,240,0,0,BadMatch()
230,0,0,,A dominatrix.,Ha!  You caught me off guard with that|stupid answer.  What's your favorite class?,240,0,0,
230,0,0,,An architect.,"Nice choice, I also thought about it.|What's your favorite class?",240,0,0,GoodMatch()
230,0,0,,A farmer.,Great!  My father is a farmer.|What's your favorite class?,240,0,0,GoodMatch()
230,0,0,,A programmer.,"Not bad, there will always be jobs.|And what's your favorite class?",240,0,0,
230,0,0,,I don't know yet.,"Same here, I'm not sure yet.|What's your favorite class?",240,0,0,GoodMatch()
240,0,0,,Math.,That's boring but it might help you I guess.|And what do you do outside of school?,250,0,0,
240,0,0,,Music.,This is such a pointless class.|What do you do outside of school?,250,0,0,BadMatch()
240,0,0,,English.,I fucking suck in fucking English!|And what do you do outside of school?,250,0,0,BadMatch()
240,0,0,,Gym.,It's not as boring as the other classes I guess.|And what do you do outside of school?,250,0,0,
240,0,0,,Chemistry.,Great!  Can you make a bomb for me?|And what do you do outside of school?,250,0,0,GoodMatch()
240,0,0,,French.,That's boring but it might help you I guess.|And what do you do outside of school?,250,0,0,
240,0,0,,Art.,This is such a pointless class.|What do you do outside of school?,250,0,0,BadMatch()
240,0,0,,History.,"Yeah, the history of wars can be fun.|And what do you do outside of school?",250,0,0,GoodMatch()
240,0,0,,Theatre.,This is such a pointless class.|What do you do outside of school?,250,0,0,
240,0,0,,I don't know.,Yeah...  Fuck these classes anyway.|What do you do outside of school?,250,0,0,GoodMatch()
250,0,0,,Basketball.,I guess there are worse hobbies.|(A waitress interrupts to take your order.),260,0,0,
250,0,0,,Rock music.,I prefer metal but rock is fine.|(A waitress interrupts to take your order.),260,0,0,GoodMatch()
250,0,0,,Video games.,I guess there are worse hobbies.|(A waitress interrupts to take your order.),260,0,0,
250,0,0,,Cheerleading.,What a shitty and boring hobby.|(A waitress interrupts to take your order.),260,0,0,
250,0,0,,Going to parties.,The parties in this college are pretty lame.|(A waitress interrupts to take your order.),260,0,0,
250,0,0,,Role playing games.,What a shitty and boring hobby.|(A waitress interrupts to take your order.),260,0,0,BadMatch()
250,0,0,,Getting drunk.,"Fair enough, I need to get wasted soon.|(A waitress interrupts to take your order.)",260,0,0,GoodMatch()
250,0,0,,Classical music.,What a shitty and boring hobby.|(A waitress interrupts to take your order.),260,0,0,BadMatch()
250,0,0,,Making love.,I guess your fucking boyfriend is happy.|(A waitress interrupts to take your order.),260,0,0,
250,0,0,,I don't have|any hobbies.,Don't worry.  Mine is getting stoned all night.|(A waitress interrupts to take your order.),260,0,0,GoodMatch()
260,0,0,,A salad please.,Are you a fucking rabbit?|(She orders a big steak.),270,-1,0,BadMatch()
260,0,0,,A steak please.,Best idea of the day!|(She also orders a steak.),270,1,0,GoodMatch()
260,0,0,,A soup please.,That's not a big meal.|(She orders a big steak.),270,0,0,
260,0,0,,A hamburger please.,A pretty good choice.|(She orders a big steak.),270,0,0,GoodMatch()
260,0,0,,A nacho platter please.,That's not a big meal.|(She orders a big steak.),270,0,0,
260,0,0,,Only cheesecake please.,That's not a big meal.|(She orders a big steak.),270,0,0,
260,0,0,,Soup and salad please.,Are you a fucking rabbit?|(She orders a big steak.),270,0,0,BadMatch()
260,0,0,,A chili dog please.,A pretty good choice.|(She orders a big steak.),270,0,0,GoodMatch()
260,0,0,,Fettuccine alfredo please.,A pretty good choice.|(She orders a big steak.),270,0,0,GoodMatch()
260,0,0,,Only water please.,Fuck!  You're not going to eat?|(She orders a big steak.),270,-1,0,BadMatch()
270,0,0,,Have a good meal!|(Wait for you meal.),Hell yeah!  (You both eat your meal.|She burps a few times and looks happy.),280,0,0,EatMeal()
270,0,0,,Bon appetite!|(Wait for you meal.),Hell yeah!  (You both eat your meal.|She burps a few times and looks happy.),280,0,0,EatMeal()
270,0,0,,Hurry up waitress!|(Wait for your meal.),Good call!  (You both eat your meal.|She burps a few times and looks happy.),280,0,1,EatMeal()
270,0,0,,(Stay silent and|wait for your meal.),Hurry up!  (You both eat your meal.|She burps a few times and looks happy.),280,0,-1,EatMeal()
280,0,0,,It was good?,Yep!  You can't go wrong with meat.|Is it time to go back to college?,290,0,0,CheckForSmoke()
280,0,0,,Are you full?,Yep!  You can't go wrong with meat.|Is it time to go back to college?,290,0,0,CheckForSmoke()
290,0,0,AllowSmoke,"Sure, let's go smoke.|(Go smoke with her.)",(You both walk to a secluded corner and|she lights up what looks like a joint.),300,0,0,
290,0,0,AllowSmoke,"Sorry, I don't smoke.|(Back to college.)",,0,0,0,EndChapter()
290,0,0,!AllowSmoke,Let's go back.|(Back to college.),,0,0,0,EndChapter()
300,0,0,,Can I have some?|(Smoke with her.),Sure!  (She smokes a big puff|and shares the joint with you.),310,1,0,Smoke()
300,0,0,,"Smoke it, I don't care.|(Don't smoke with her.)",You only smoke cigarettes then?|(She takes three big puffs of her joint.),320,-1,0,Smoke()
300,0,0,,Gimme that joint!|(Smoke with her.),Here you go.  (She|passes the joint to you.),310,1,1,Smoke()
300,0,0,,Smoking is bad for you.|(Don't smoke with her.),What are you?  A fucking police?|(She takes three big puffs of her joint.),320,-1,-1,Smoke()
300,0,0,,Is it safe to smoke?|(Smoke with her.),Can't be safer.  (She smokes a big|puff and shares the joint with you.),310,1,-1,Smoke()
300,0,0,,No!  This is illegal!|(Don't smoke with her.),You're such a pathetic loser.|(She takes three big puffs of her joint.),320,-2,-2,Smoke()
310,0,0,,This is great!|(Smoke the joint.),Yep!  Leave some for me though.|(You take a few puffs on the joint.),310,0,0,Smoke()
310,0,0,,Thanks for that.|(Pass the joint.),(You pass the joint and she|takes three quick puffs on it.),320,0,0,Smoke()
320,0,0,,How often do|you smoke weed?,Every day!  Best medicine against boredom.|(She smokes two puffs and sits down wasted.),330,0,0,Smoke()
320,0,0,,"Careful, you'll be|stoned for class.",Don't you think I already know that?|(She smokes two puffs and sits down wasted.),330,0,-1,Smoke()
320,0,0,,That's great!  We need to|lunch together more often.,Fuck yeah!  We can get stoned every day.|(She smokes two puffs and sits down wasted.),330,1,0,Smoke()
330,0,0,,Are you ok?,Oh hell yeah!|(She looks stoned.),330,0,0,
330,0,0,,We should|skip school.,Oh yeah!  Best idea ever!|(She giggles and stares blankly.),330,0,0,
330,0,0,HateAmanda,Do you want to get|even with Amanda?,Fuck yeah!  Let's do it now.|Will you help beat her up?,400,0,0,
330,0,0,HateSarah,Do you want to get|even with Sarah?,Fuck yeah!  Let's do it now.|Will you help beat her up?,500,0,0,
330,0,0,,(Smoke with her.)|(1 minute),(You both share a puff and sit idly.),330,0,0,
330,0,0,,(Stare at her.)|(1 minute),(You stare at her idly while|she smokes a puff in your face.),330,0,0,
330,0,0,,(Remove her clothes.)|(1 minute),(She stares and pushes your hand away.)|(You need +8 love or submission to strip her.),330,0,0,RemoveClothes()
330,0,0,,Let's go back.|(Back to college.),,0,0,0,EndChapter()
340,0,0,!IsGagged,Are you ok?,Oh hell yeah!|(She looks stoned.),340,0,0,
340,0,0,!CuteRemarkDone,You look pretty|cute like that.,"(She looks at herself, blushes|a little and nods back at you.)",340,0,0,CuteRemark()
340,0,0,,(Tickle her.)|(1 minute),(Either she's not ticklish or she's|too stoned but she doesn't react much.),340,0,0,
340,0,0,,(Masturbate her.)|(1 minute),,340,0,0,Masturbate()
340,0,0,IsRoped,(Untie her.)|(1 minute),(She seems to appreciate but doesn't|react that much while you untie her.),340,0,0,Untie()
340,0,0,IsGagged,(Ungag her.)|(1 minute),(You ungag her and she stares at you.)|Oh Fuck!  This is pretty intense.,340,0,0,Ungag()
340,0,0,,(Dress her back.)|(1 minute),(You let her go and she|puts her clothes back on.),330,0,0,Release()
340,0,0,IsBoundAndGagged,I tricked you bitch.|(Leave her stranded.),,340,0,0,EvilEnd()
340,0,0,,Let's go back.|(Back to college.),,0,0,0,EndChapter()
350,0,0,,Cum for me sweetie.|(Make her climax.),(You masturbate her gently while she|moans and surrenders to a sweet orgasm.),340,1,0,Orgasm()
350,0,0,,Cum now little whore.|(Make her climax.),(You masturbate her forcefully and|she climaxes with a great orgasm.),340,0,1,Orgasm()
350,0,0,,"Not now, maybe later.|(Don't let her climax.)",(You stop masturbating her|and she slowly stops to moan.),340,-1,0,NoOrgasm()
350,0,0,,You don't deserve it.|(Don't let her climax.),(You stop masturbating her|and she slowly stops to moan.),340,0,-1,NoOrgasm()
400,0,0,,"Beat up Amanda?|No, it's too extreme.",It's not extreme enough!|Someday she will pay.,330,0,0,
400,0,0,,Yes!  Let's get|her right now.,Come with me then!  (You both walk to|an empty class where Amanda is reading.),410,0,0,StartBeatUp()
410,0,0,,(Help Sidney to subdue|Amanda.)  (1 minute),(You both jump on Amanda and Sidney|gets a holds on her.)  Strip her down!,420,1,0,
410,0,0,,I cannot do that.|(Don't subdue Amanda.),You fucking traitor!  You're lucky Amanda.|(Amanda quickly packs her stuff and runs away.),490,-3,-2,
420,0,0,,(Help Sidney to strip|Amanda.)  (1 minute),(You strip her down naked while|Sidney holds her.)  Beat her!,430,1,0,
420,0,0,,I cannot do that.|(Let Amanda go.),You fucking traitor!  You're lucky Amanda.|(Amanda quickly packs her stuff and runs away.),490,-3,-2,
430,0,0,,(Beat up Amanda.)|(1 minute),(You kick and punch Amanda until she|crumbles to the ground.)  Let me do the rest!,440,0,1,"BeatUp(""Amanda"")"
430,0,0,,I'm too weak Miss.|(1 minute),(Sidney struggles alone and beats up Amanda that|crumbles to the ground.)  Move away girl!,440,0,-1,
430,0,0,,I cannot do that.|(Let Amanda go.),You fucking traitor!  You're lucky Amanda.|(Amanda quickly packs her stuff and runs away.),490,-3,-2,
440,0,0,,Go ahead!|(1 minute),(Sidney gags and hogties Amanda.)|Let's run before we get caught!,450,1,0,"TieUp(""Amanda"")"
440,0,0,,This is going too far.|(Help Amanda to get up.),You fucking traitor!  You're lucky Amanda.|(Amanda quickly packs her stuff and runs away.),490,-3,-2,
450,0,0,,Yes Miss Sidney.|(Leave her stranded.),,0,0,-1,"CrimeStranded(""Amanda"")"
450,0,0,,Run like hell girl!|(Leave her stranded.),,0,0,1,"CrimeStranded(""Amanda"")"
450,0,0,,This is going too far.|(Release her.)  (1 minute),You fucking traitor!  You're lucky Amanda.|(Amanda quickly packs her stuff and runs away.),490,-3,-2,
490,0,0,,Let's go back.|(Back to classes.),,0,0,0,EndChapter()
500,0,0,,"Beat up Sarah?|No, it's too extreme.",It's not extreme enough!|Someday she will pay.,330,0,0,
500,0,0,,Yes!  Let's get|her right now.,Come with me then!  (You both walk to|the schoolyard where Sarah is chilling.),510,0,0,StartBeatUp()
510,0,0,,(Help Sidney to subdue|Sarah.)  (1 minute),(You both jump on Sarah and Sidney|gets a holds on her.)  Strip her down!,520,1,0,
510,0,0,,I cannot do that.|(Don't subdue Sarah.),You fucking traitor!  You're lucky Sarah.|(Sarah pulls her tongue and quickly runs away.),590,-3,-2,
520,0,0,,(Help Sidney to strip|Sarah.)  (1 minute),(You strip her down naked while|Sidney holds her.)  Beat her!,530,1,0,
520,0,0,,I cannot do that.|(Let Sarah go.),You fucking traitor!  You're lucky Sarah.|(Sarah pulls her tongue and quickly runs away.),590,-3,-2,
530,0,0,,(Beat up Sarah.)|(1 minute),(You kick and punch Sarah until she|crumbles to the ground.)  Let me do the rest!,540,0,1,"BeatUp(""Sarah"")"
530,0,0,,I'm too weak Miss.|(1 minute),(Sidney struggles alone and beats up Sarah that|crumbles to the ground.)  Move away girl!,540,0,-1,
530,0,0,,I cannot do that.|(Let Sarah go.),You fucking traitor!  You're lucky Sarah.|(Sarah pulls her tongue and quickly runs away.),590,-3,-2,
540,0,0,,Go ahead!|(1 minute),(Sidney gags and binds Sarah on the fence.)|Let's fucking run before we get caught!,550,1,0,"TieUp(""Sarah"")"
540,0,0,,This is going too far.|(Help Sarah to get up.),You fucking traitor!  You're lucky Sarah.|(Sarah pulls her tongue and quickly runs away.),590,-3,-2,
550,0,0,,Yes Miss Sidney.|(Leave her stranded.),,0,0,-1,"CrimeStranded(""Sarah"")"
550,0,0,,Run like hell girl!|(Leave her stranded.),,0,0,1,"CrimeStranded(""Sarah"")"
550,0,0,,This is going too far.|(Release her.)  (1 minute),You fucking traitor!  You're lucky Sarah.|(Sarah pulls her tongue and quickly runs away.),590,-3,-2,
590,0,0,,Let's go back.|(Back to classes.),,0,0,0,EndChapter()
